{
  "stages": [
    "0-assess",
    "1-plan",
    "2-deploy",
    "3-pilot",
    "4-scale-up",
    "5-sustain"
  ],
  "domains": [
    "Governance",
    "Project Management",
    "Software & Systems",
    "Data Sharing & Interoperability",
    "Data Quality & Standards",
    "Training & Support",
    "Data Use & Reporting",
    "Deliverable",
    "Ongoing"
  ],
  "matrix": {
    "Governance": {
      "Assess": [
        "Identify the primary champions, or stakeholders, of iHRIS.",
        "Determine whether there is an established regional body or health organization, such as a Health Workforce Observatory, that can provide technical assistance or additional resources."
      ],
      "Plan": [
        "Working with identified leaders, determine which representatives from stakeholder groups to invite to join the SLG. In the initial meeting, agree on Principles of Operation and Terms of Reference for the group."
      ],
      "Deploy": [
        "Document any standard operating procedures that exist or have been decided on by the SLG."
      ],
      "Pilot": [
        "Meet with the SLG to share the pilot plan and decide how results will be communicated."
      ],
      "Scale-up": [
        "Institute routine reporting of scale-up progress to the SLG."
      ],
      "Sustain": [
        "Plan for regular customizations of iHRIS to support emerging business processes"
      ]
    },
    "Project Management": {
      "Assess": [
        "Understand issues involved in planning an information systems project and developing a health information system.",
        "Present the problems to be solved and the benefits of using iHRIS to stakeholders. Get consensus from the leaders on the outcomes they expect from the implementation."
      ],
      "Plan": [
        "Develop roles and responsibilities for the members of the implementation team.",
        "Establish tools for managing the project and working with the implementation team."
      ],
      "Deploy": [
        "Monitor whether customizations to iHRIS conform to the system requirements. Test the software with users or stakeholders to determine if the customizations meet expectations. If a change to the requirements is needed, log the change and the reason for it."
      ],
      "Pilot": [
        "As the pilot progresses, document any issues that arise. Consult the SLG on any major changes that need to be made."
      ],
      "Scale-up": [
        "Prepare a phased rollout plan for scaling up iHRIS. Include projected costs and funding, as well as infrastructure, human resource needs (including roles and responsibilities), technical support, and training plans."
      ],
      "Sustain": [
        "Develop a plan for systematic monitoring and evaluation of iHRIS using predefined indicators."
      ]
    },
    "Software & Systems": {
      "Assess": [
        "Conduct an assessment survey of existing HRH information systems, processes, data collection forms, and standards. Assess existing infrastructure available to support the system and document any gaps."
      ],
      "Plan": [
        "With the SLG and the implementation team, collaboratively develop the system requirements and document them using a standard methodology."
      ],
      "Deploy": [
        "Download, install, set up, and customize the iHRIS software."
      ],
      "Pilot": [
        "Discuss with the software developers new requirements that emerge during the pilot. Decide which new features to develop using an iterative approach."
      ],
      "Scale-up": [
        "Assess available ICT infrastructure and support in the districts and/or facilities where iHRIS will be deployed."
      ],
      "Sustain": [
        "Create a maintenance plan for supporting iHRIS. Follow up with users to determine how iHRIS is performing.",
        "Determine whether new customizations or extensions of iHRIS are required to meet users’ needs. Document the requirements and develop them iteratively."
      ]
    },
    "Data Sharing & Interoperability": {
      "Assess": [
        "Conduct an assessment survey of existing HIS. Review the country’s eHealth strategy, if there is one, and document any policies that need to be followed."
      ],
      "Plan": [
        "Identify standards to use when sharing data with other systems in the HIS."
      ],
      "Deploy": [
        "If existing data are available in electronic format, you may choose to import the data into iHRIS during this phase. Before importing, convert data to standardized data lists [ref to Tool1-D]. Otherwise, collect and enter initial data during the Pilot phase, after ensuring that data collection tools report according to the standardized data lists. See iHRIS Technical Documentation for instructions on how to import and store data in iHRIS."
      ],
      "Pilot": [
        "Determine whether to establish a link with another information system and share data as part of the pilot project. With the SLG, create a data-sharing agreement to set policies for how data will be shared, used, and protected."
      ],
      "Scale-up": [
        "Determine whether any HIS in the rollout regions can benefit from sharing data with iHRIS. If so, establish a method and agreements for sharing data."
      ],
      "Sustain": [
        "Consider sharing data from iHRIS regionally or internationally."
      ]
    },
    "Data Quality & Standards": {
      "Assess": [
        "Understand the sources of HRH data and communicate the value of health workforce information."
      ],
      "Plan": [
        "Identify the sources of standard HRH data to be used in iHRIS. Determine whether the data are consistently formatted and coded across these sources. If not, decide with the SLG what the standards should be and document them with the system requirements.",
        "Review with the SLG data collection processes and forms. Revise forms to provide the minimum necessary dataset to answer policy and management questions."
      ],
      "Deploy": [
        "Customize fields, forms, and modules in iHRIS according to the agreed-upon data standards."
      ],
      "Pilot": [
        "Institute procedures to reduce data entry errors."
      ],
      "Scale-up": [
        "Work with the organization responsible for oversight of data to create a plan for ensuring data quality."
      ],
      "Sustain": [
        "Develop a routine schedule and procedure for collecting and updating human resources data.",
        "Institute a regular data audit to validate the accuracy of HRH data."
      ]
    },
    "Training & Support": {
      "Assess": [
        "Assess resources available to support trainings and document any gaps. Identify potential training sites."
      ],
      "Plan": [
        "Train data collectors to use revised data collection forms. Data collection can begin at any point after the data collectors are trained."
      ],
      "Deploy": [
        "Develop and implement a program for training ICT staff on administering iHRIS. Plan for how ongoing support of iHRIS will be provided, including needed skills updates."
      ],
      "Pilot": [
        "Train data entrants, iHRIS users, and HR managers participating in the pilot on how to use iHRIS. Collect and enter data for the pilot area."
      ],
      "Scale-up": [
        "Prepare a training plan for each area where iHRIS is implemented. Include a plan for training of trainers who can orient new employees or users to iHRIS.",
        "Implement a training program in data use for senior executives and other data users."
      ],
      "Sustain": [
        "Plan for how to provide technical support for iHRIS over the long term. Establish a helpdesk and user documentation such as Frequently Asked Questions.",
        "Plan for continuing ICT skills development."
      ]
    },
    "Data Use & Reporting": {
      "Assess": [
        "With stakeholders, begin defining the key HRH policy and management questions that need to be answered by the HRIS."
      ],
      "Plan": [
        "Document requirements for reports produced by iHRIS."
      ],
      "Deploy": [
        "Customize reports based on the reporting requirements. Produce sample reports for testing. Engage with the SLG early on the report templates. See iHRIS Technical Documentation for instructions on how to customize reports."
      ],
      "Pilot": [
        "Run pilot reports and present them to the SLG. Based on feedback, make any additional customizations to the reports. Share the successful results of the pilot with the SLG and other interested parties. Encourage the stakeholders to promote iHRIS."
      ],
      "Scale-up": [
        "Assess routine reporting needs. Document standard operating procedures for reporting."
      ],
      "Sustain": [
        "Establish routine evaluation of how data from iHRIS is used.",
        "Discuss with stakeholders the value of making reports from iHRIS publicly available. Consider methods for publicly distributing this information that are appropriate for the context. Share success stories from iHRIS such as money saved."
      ]
    },
    "Deliverable": {
      "Assess": [
        "Document the assessment results in a report for stakeholders. Based on the results, diagram the links between producers and users of HRH information to determine how data move through the systems and to whom it will be reported. Identify gaps in supporting ICT infrastructure."
      ],
      "Plan": [
        "Write the project implementation plan and attach the system and reporting requirements, as well as any data collection forms and supporting documentation. Share the plan with the SLG for their approval before proceeding with deployment."
      ],
      "Deploy": [